{
  "authority": "authoritative",
  "capture": {
    "interfaces": [],
    "link_types": [
      228
    ]
  },
  "created_utc": "2026-07-10T00:00:00Z",
  "expected": {
    "diagnostic_codes": [],
    "exact_rebuild": true,
    "layers": [
      "ipv4",
      "icmpv4"
    ],
    "link_type": 228,
    "notes": "LINKTYPE_IPV4 ICMP echo known-answer packet",
    "valid": true
  },
  "fixture": "frames/raw/linktype-ipv4-icmp.bin",
  "kind": "frame",
  "license": {
    "evidence": "Synthetic fixture authored for the PacketcraftR XOD-60 corpus; no production capture, private data, or third-party payload is included",
    "spdx": "CC0-1.0"
  },
  "protocols": [
    "ipv4",
    "icmpv4"
  ],
  "review": {
    "evidence": "https://linear.app/xodud/issue/XOD-36",
    "reviewed_utc": "2026-07-10T00:00:00Z",
    "reviewer": "Codex XOD-36 automated implementation review"
  },
  "schema": "packetcraftr.fixture-provenance/v1",
  "sha256": "203d681e91c132906e2e1a87c9810788ca0da20260b33c0fce3e9d2fc00a36fc",
  "source": {
    "description": "LINKTYPE_IPV4 ICMP echo known-answer packet",
    "generator": {
      "invocation": "python3 scripts/seed-fixture-corpus.py --write --verify-tcpdump",
      "name": "Python standard library",
      "summary": "Deterministic network-byte-order construction with explicit checksums and lengths",
      "version": "3.12.3"
    },
    "oracle": {
      "invocation": "tcpdump -nn -vvv -r <deterministic wrapper capture>",
      "name": "tcpdump/libpcap",
      "summary": "Independent libpcap parser accepted the frame/capture and decoded its documented root",
      "version": "tcpdump version 4.99.4 / libpcap version 1.10.4 (with TPACKET_V3)"
    },
    "reference": "https://www.tcpdump.org/linktypes.html",
    "type": "generated"
  }
}
