{
  "authority": "authoritative",
  "capture": {
    "interfaces": [],
    "link_types": [
      113
    ]
  },
  "created_utc": "2026-07-10T00:00:00Z",
  "expected": {
    "diagnostic_codes": [],
    "exact_rebuild": true,
    "layers": [
      "linux_sll",
      "ipv4",
      "icmpv4"
    ],
    "link_type": 113,
    "notes": "Linux cooked capture v1 IPv4 ICMP frame",
    "valid": true
  },
  "fixture": "frames/sll/ipv4-icmp.bin",
  "kind": "frame",
  "license": {
    "evidence": "Synthetic fixture authored for the PacketcraftR XOD-60 corpus; no production capture, private data, or third-party payload is included",
    "spdx": "CC0-1.0"
  },
  "protocols": [
    "linux_sll",
    "ipv4",
    "icmpv4"
  ],
  "review": {
    "evidence": "https://linear.app/xodud/issue/XOD-60",
    "reviewed_utc": "2026-07-10T00:00:00Z",
    "reviewer": "Codex XOD-60 automated implementation review"
  },
  "schema": "packetcraftr.fixture-provenance/v1",
  "sha256": "e5fd86170caa3530a6ce2d6a986f035c9b73f1dbf5f4dfab837526c9b61c5dd4",
  "source": {
    "description": "Linux cooked capture v1 IPv4 ICMP frame",
    "generator": {
      "invocation": "python3 scripts/seed-fixture-corpus.py --write --verify-tcpdump",
      "name": "Python standard library",
      "summary": "Deterministic network-byte-order construction with explicit checksums and lengths",
      "version": "3.12.3"
    },
    "oracle": {
      "invocation": "tcpdump -nn -vvv -r <deterministic wrapper capture>",
      "name": "tcpdump/libpcap",
      "summary": "Independent libpcap parser accepted the frame/capture and decoded its documented root",
      "version": "tcpdump version 4.99.4 / libpcap version 1.10.4 (with TPACKET_V3)"
    },
    "reference": "https://www.tcpdump.org/linktypes.html",
    "type": "generated"
  }
}
