{
  "authority": "authoritative",
  "capture": {
    "interfaces": [
      {
        "id": 0,
        "link_type": 1
      },
      {
        "id": 1,
        "link_type": 101
      }
    ],
    "link_types": [
      1,
      101
    ]
  },
  "created_utc": "2026-07-10T00:00:00Z",
  "expected": {
    "diagnostic_codes": [],
    "exact_rebuild": true,
    "layers": [
      "ethernet",
      "ipv4",
      "udp",
      "icmpv4",
      "raw"
    ],
    "link_type": null,
    "notes": "PCAPNG section with Ethernet and DLT_RAW interfaces",
    "valid": true
  },
  "fixture": "captures/pcapng/multi-link.pcapng",
  "kind": "pcapng",
  "license": {
    "evidence": "Synthetic fixture authored for the PacketcraftR XOD-60 corpus; no production capture, private data, or third-party payload is included",
    "spdx": "CC0-1.0"
  },
  "protocols": [
    "ethernet",
    "ipv4",
    "udp",
    "icmpv4",
    "raw"
  ],
  "review": {
    "evidence": "https://linear.app/xodud/issue/XOD-60",
    "reviewed_utc": "2026-07-10T00:00:00Z",
    "reviewer": "Codex XOD-60 automated implementation review"
  },
  "schema": "packetcraftr.fixture-provenance/v1",
  "sha256": "8cace9a2c86e5b25f6ccac0fc478bd6f49aa4b13d7e9c10fac4d6f1d00a69d2a",
  "source": {
    "description": "PCAPNG section with Ethernet and DLT_RAW interfaces",
    "generator": {
      "invocation": "python3 scripts/seed-fixture-corpus.py --write --verify-tcpdump",
      "name": "Python standard library",
      "summary": "Deterministic network-byte-order construction with explicit checksums and lengths",
      "version": "3.12.3"
    },
    "oracle": null,
    "reference": "https://www.ietf.org/archive/id/draft-tuexen-opsawg-pcapng-05.html",
    "type": "generated"
  }
}
