{
  "authority": "authoritative",
  "capture": {
    "interfaces": [],
    "link_types": [
      0
    ]
  },
  "created_utc": "2026-07-10T00:00:00Z",
  "expected": {
    "diagnostic_codes": [],
    "exact_rebuild": true,
    "layers": [
      "bsd_null",
      "ipv6",
      "udp",
      "raw"
    ],
    "link_type": 0,
    "notes": "Big-endian BSD NULL AF_INET6 header followed by IPv6 UDP",
    "valid": true
  },
  "fixture": "frames/null/ipv6-big-endian.bin",
  "kind": "frame",
  "license": {
    "evidence": "Synthetic fixture authored for the PacketcraftR XOD-60 corpus; no production capture, private data, or third-party payload is included",
    "spdx": "CC0-1.0"
  },
  "protocols": [
    "bsd_null",
    "ipv6",
    "udp",
    "raw"
  ],
  "review": {
    "evidence": "https://linear.app/xodud/issue/XOD-36",
    "reviewed_utc": "2026-07-10T00:00:00Z",
    "reviewer": "Codex XOD-36 automated implementation review"
  },
  "schema": "packetcraftr.fixture-provenance/v1",
  "sha256": "551ef3aac83c39a30cdf07767c928e4148605f8c938c4552c387a4954e8848d8",
  "source": {
    "description": "Big-endian BSD NULL AF_INET6 header followed by IPv6 UDP",
    "generator": {
      "invocation": "python3 scripts/seed-fixture-corpus.py --write --verify-tcpdump",
      "name": "Python standard library",
      "summary": "Deterministic network-byte-order construction with explicit checksums and lengths",
      "version": "3.12.3"
    },
    "oracle": null,
    "reference": "https://www.tcpdump.org/linktypes.html",
    "type": "generated"
  }
}
