{
  "schema": "packetcraftr.fixture-provenance/v1",
  "fixture": "frames/example/single-zero-octet.bin",
  "sha256": "6e340b9cffb37a989ca544e6bb780a2c78901d3fb33738768511a30617afa01d",
  "kind": "frame",
  "authority": "authoritative",
  "created_utc": "2026-07-09T00:00:00Z",
  "protocols": [
    "raw"
  ],
  "capture": null,
  "source": {
    "type": "generated",
    "description": "Documentation-only example representing one zero octet",
    "reference": "https://example.invalid/source-reference",
    "generator": {
      "name": "printf",
      "version": "GNU coreutils 9.5",
      "invocation": "printf '\\x00' > single-zero-octet.bin"
    },
    "oracle": null
  },
  "license": {
    "spdx": "CC0-1.0",
    "evidence": "Example authored for the PacketcraftR repository by the contributor"
  },
  "expected": {
    "link_type": null,
    "layers": [
      "raw"
    ],
    "diagnostic_codes": [],
    "exact_rebuild": true,
    "valid": true,
    "notes": "The referenced binary is intentionally not committed; this .example.json file is a template only."
  },
  "review": {
    "reviewer": "replace with reviewer identity",
    "reviewed_utc": "2026-07-09T00:00:00Z",
    "evidence": "https://example.invalid/review-evidence"
  }
}
