{
  "authority": "authoritative",
  "capture": {
    "interfaces": [],
    "link_types": [
      1
    ]
  },
  "created_utc": "2026-07-10T00:00:00Z",
  "expected": {
    "diagnostic_codes": [],
    "exact_rebuild": true,
    "layers": [
      "ethernet",
      "ipv4",
      "udp",
      "raw"
    ],
    "link_type": 1,
    "notes": "Ethernet/IPv4/UDP known-answer frame over documentation addresses",
    "valid": true
  },
  "fixture": "frames/ethernet/ipv4-udp.bin",
  "kind": "frame",
  "license": {
    "evidence": "Synthetic fixture authored for the PacketcraftR XOD-60 corpus; no production capture, private data, or third-party payload is included",
    "spdx": "CC0-1.0"
  },
  "protocols": [
    "ethernet",
    "ipv4",
    "udp",
    "raw"
  ],
  "review": {
    "evidence": "https://linear.app/xodud/issue/XOD-60",
    "reviewed_utc": "2026-07-10T00:00:00Z",
    "reviewer": "Codex XOD-60 automated implementation review"
  },
  "schema": "packetcraftr.fixture-provenance/v1",
  "sha256": "76057973a2844666f7bca26d9ef8efad09a2e2e40b042a37396c5898a3d6d63e",
  "source": {
    "description": "Ethernet/IPv4/UDP known-answer frame over documentation addresses",
    "generator": {
      "invocation": "python3 scripts/seed-fixture-corpus.py --write --verify-tcpdump",
      "name": "Python standard library",
      "summary": "Deterministic network-byte-order construction with explicit checksums and lengths",
      "version": "3.12.3"
    },
    "oracle": {
      "invocation": "tcpdump -nn -vvv -r <deterministic wrapper capture>",
      "name": "tcpdump/libpcap",
      "summary": "Independent libpcap parser accepted the frame/capture and decoded its documented root",
      "version": "tcpdump version 4.99.4 / libpcap version 1.10.4 (with TPACKET_V3)"
    },
    "reference": "https://www.rfc-editor.org/rfc/rfc894",
    "type": "generated"
  }
}
