{
  "authority": "derived",
  "capture": null,
  "created_utc": "2026-07-10T00:00:00Z",
  "expected": {
    "diagnostic_codes": [],
    "exact_rebuild": true,
    "layers": [
      "ipv4",
      "udp",
      "raw"
    ],
    "link_type": null,
    "notes": "Versioned JSON packet document for strict IPv4/UDP construction",
    "valid": true
  },
  "fixture": "documents/ipv4-udp.json",
  "kind": "document",
  "license": {
    "evidence": "Synthetic fixture authored for the PacketcraftR XOD-60 corpus; no production capture, private data, or third-party payload is included",
    "spdx": "CC0-1.0"
  },
  "protocols": [
    "ipv4",
    "udp",
    "raw"
  ],
  "review": {
    "evidence": "https://linear.app/xodud/issue/XOD-60",
    "reviewed_utc": "2026-07-10T00:00:00Z",
    "reviewer": "Codex XOD-60 automated implementation review"
  },
  "schema": "packetcraftr.fixture-provenance/v1",
  "sha256": "24963bfb12daa717a724d9bd4516146e3361afd4560b75a276b77866c3793f1c",
  "source": {
    "description": "Versioned JSON packet document for strict IPv4/UDP construction",
    "generator": {
      "invocation": "python3 scripts/seed-fixture-corpus.py --write --verify-tcpdump",
      "name": "Python standard library",
      "summary": "Deterministic network-byte-order construction with explicit checksums and lengths",
      "version": "3.12.3"
    },
    "oracle": null,
    "reference": "https://raw.githubusercontent.com/tyk-swe/pcr/main/schemas/packetcraftr.packet.v1.schema.json",
    "type": "derived"
  }
}
